{
  "loanDecisionDate": "2016-01-20",
  "applicationOriginationDate": "2016-01-05",
  "applicationDecisionStatus": "pre-approved",
  "loanAccountStatus": "new",
  "loanAccountSubStatus": "new",
  "noteNumber": 1111,
  "category": "home",
  "purposeCode": "123",
  "requestedAmount": 200000,
  "noteAmount": 210000,
  "creditLimit": 250000,
  "creditLimitExpiration": "2035-01-20",
  "creditLimitGroupCode": "123",
  "creditReportingCode": "123",
  "isRevolvingLineOfCredit": false,
  "minimumAdvanceAmount": 0,
  "maximumAdvanceAmount": 0,
  "originationDate": "2016-01-05",
  "disbursalDate": "2016-01-10",
  "creationDate": "2016-01-20",
  "term": "15",
  "combinedCreditScore": 785,
  "loanInterestRateDetail": 0.036,
  "paymentOption": "monthly",
  "dailyPeriodicRate": 0,
  "totalNumberOfPayments": 180,
  "prePaidFinanceCharges": 0.0,
  "prepaidInterest": 0.0,
  "interestPaidThruDate": "",
  "numberOfGraceDays": 0,
  "balloonAmount": 0.0,
  "balloonDueDate": "",
  "balloonDueDateTermValue": "",
  "prepaymentPenaltyBasisAmount": 0,
  "prepaymentPenaltyPercentage": 0,
  "prepaymentPenaltyExpirationDate": "",
  "statementCode": "",
  "statementGroup": "",
  "statementDate": "",
  "debtIncomeRatio": 0.43


}